{
  "mechanism": "classification_link",
  "events": [
    "leo_resolve",
    "zeph_resolve",
    "bridge_attempt",
    "bridge_stable"
  ],
  "timing": {
    "intro_seconds": 6.4,
    "investigation_seconds": 14.0,
    "result_hold_seconds": 2.6,
    "cta_seconds": 7.0
  },
  "palette_profile": "revelation",
  "camera_profile": "wide_investigation",
  "node_profile": "stable_then_overload",
  "projection_profile": "warning_trace",
  "cta_profile": "warning",
  "audio_cue": "investigation"
}
