{
  "mechanism": "classification_link",
  "events": [
    "leo_resolve",
    "zeph_resolve",
    "bridge_attempt",
    "bridge_stable"
  ],
  "timing": {
    "intro_seconds": 6.2,
    "investigation_seconds": 12.0,
    "result_hold_seconds": 2.0,
    "cta_seconds": 7.8
  },
  "palette_profile": "mystery",
  "camera_profile": "wide_investigation",
  "node_profile": "analytical",
  "projection_profile": "classification",
  "cta_profile": "cool_signal",
  "audio_cue": "investigation"
}
